product_name,price
【CITY STAR】小清新中小學生日期學習手錶3色-2入,250
CASIO 卡西歐 MQ-24 極簡時尚指針中性手錶,420
CASIO 卡西歐 G-SHOCK 極簡八角 太陽能電力智慧藍牙手錶 GA-B2100-1A1,5200
CASIO 卡西歐 MRW-200H 時尚低調系列防水運動手錶,735
CASIO 卡西歐 G-SHOCK 八角農家橡樹 全金屬版 太陽能藍芽連線雙顯手錶-銀 GM-B2100D-1A,13500
MIRRO 米羅 / 6998L-RPS / 典雅精緻 藍寶石水晶玻璃 不鏽鋼手錶 粉色 32mm,1680
時刻美SKMEI 不鏽鋼圈 多功能電子錶 休閒錶 運動錶 男錶 學生錶 手錶,495
【CITY STAR】小清新中小學生日期學習手錶3色,180
SEIKO 精工 SSB425P1 CS系列 熊貓錶計時手錶-41.5mm 8T63-00W0S,5916
【SKMEI】簡約復古風石英錶(防水手錶 石英錶 交換禮物 手錶 考試手錶 簡約手錶/2050),549
SEIKO 精工 Laurel 製錶110周年紀念 限量 太陽能手錶(SBPX149J/V157-0DV0J),6960
SEIKO 精工 CS 鈦金屬簡約手錶-40mm SUR373P1 6N52-00B0V,7656
CASIO 卡西歐 G-SHOCK 極簡八角 太陽能電力智慧藍牙手錶 GA-B2100-1A,3640
CASIO 卡西歐 EDIFICE 八角運動計時手錶 EFV-640DC-3AV,4000
SEIKO精工 CS 三眼計時紳士手錶-39.5mm (SSB423P1/8T67-00S0N),7656
SEIKO 精工 SSB430P1 CS系列 金色熊貓錶計時手錶-41.5mm 8T63-00W0KS,6612
CASIO 卡西歐 Outdoor 潛水風運動手錶-卡其 MRW-210H-5A,1260
CASIO 卡西歐 EDIFICE 太陽能 纖薄動感運動風計時手錶 EFS-S610DB-1A,5600
CASIO 卡西歐 LTP-1094Q 時尚簡約文青小巧錶面金框皮帶手錶,999
Korea Style 簡約金屬紋質感手錶,680
